input_text,target_text
我已經精神錯亂,我現在非常疲憊。
這邊有夠鬧,這裡的情況非常混亂。
拜託你別再講廢話,請你講重點。
太扯真的想翻白眼,這件事太誇張了。
感覺整個人都沒了,我覺得非常疲累。
不要鬧了拜託,請你嚴肅一點。
現在我只想裝死,我現在只想靜一靜。
怎樣啦你有病哦,你這樣的行為很奇怪。
他這句話真的雷爆,他講的話很不妥。
快被煩死了啦,我真的快被煩壞了。
一整天都在混亂中度過,我今天非常混亂。
這什麼謎之操作,這做法我無法理解。
到底誰教他的啦,他這樣做令人不解。
真的是負能量爆棚,我現在心情非常低落。
看到直接想原地掩埋,我看到後感到極度尷尬。
腦袋整個登出,我完全無法思考。
現在狀況直接宕機,我現在狀態很差。
我真心無語,我真的無話可說。
聽完想直接跳海,我完全無法接受。
講話可以別那麼浮誇嗎,你說話能不能收斂一點。
現在超想人間蒸發,我現在只想一個人待著。
不要再搞我情緒,請不要再讓我生氣。
這件事已經爛掉,這件事情已經無可挽回。
這人講話真的雷包,他說話總是出錯。
當場想原地斷線,我當場無法反應。
這邏輯根本不通,他的說法毫無邏輯。
笑爛也太荒謬,這件事真的太荒唐。
講得好像你很懂,你講得好像你什麼都知道。
現在整個大崩潰,我現在情緒失控。
我不知道該不該哭,我不知道該怎麼反應。
心情差到不行,我心情非常不好。
講話可以不要這麼跳針嗎,你講話能不能有條理一點。
我直接黑白畫面,我整個人愣住了。
我已經放棄思考,我現在不想再想這件事。
不要再丟爛哏了,請不要再開冷笑話。
這人真的沒在思考,他完全沒想清楚。
看到直接內傷,我看到之後非常難受。
真的想舉白旗投降,我真的想放棄。
講話跟沒講一樣,你的話完全沒意義。
這也太鬼打牆,你講的內容重複又沒重點。
腦袋整個放空,我一片空白。
我語塞,我不知道該怎麼接話。
這啥爛回答,你的回答讓人無法接受。
我今天整個超不想上班,我今天真的很不想上班。
他人超怪超雷,他個性很奇怪，而且不可靠。
這個東西我無言以對惹,我不知道該怎麼評價這東西。
你也太會講屁話了吧,你講的話太沒有重點了。
這啥鬼啦看不懂,這是什麼？我看不懂。
都怪我自己太廢,我覺得自己能力不夠。
一直重複重複到底幹嘛,為什麼要一直重複同樣的事？
我直接發瘋然後飛起來,我真的快要崩潰了。
你講這句我整個人爆炸,你這句話讓我很生氣。
講話都沒過腦,說話前應該要想清楚。
事情一堆我時間根本不夠用,事情太多了，我根本忙不過來。
一整天都在爆炸邊緣,我一整天情緒都快失控。
又來了啦煩欸,又發生了，真的讓人煩躁。
到底要我幹嘛啦,你到底希望我做什麼？
頭好痛人好煩事好多,我頭痛、心煩，事情又多。
這件事我真的不OK,我無法接受這件事。
現在情緒很炸掉,我現在情緒非常不穩。
到底是什麼鬼設計,這設計到底是怎麼回事？
別鬧啦現在不是時候,別開玩笑，現在不合適。
都怪那個人害我炸鍋,是那個人讓我情緒失控。
已經不知道自己在幹嘛,我完全迷失了方向。
突然爆炸完全沒預警,情況突然失控，毫無預兆。
我已經不是我了,我感覺自己變了。
他整個句點王,他總是讓對話結束得很尷尬。
笑死這爛到我不想看,這真的太差了，我不想再看。
我心態崩得比玻璃還快,我心理狀態一下子就崩潰了。
腦袋瞬間當機中,我一時之間反應不過來。
真的給他一個大問號,我對他感到非常困惑。
"整件事已經問號連發,整件事情讓人產生很多疑問。",整件事情讓人產生很多疑問。
我現在只想原地爆炸,我現在非常想要發脾氣。
幹嘛這樣搞我啦,為什麼要這樣對我？
"當場崩人設,",當場形象全毀。
這邏輯有大漏洞,這邏輯不合理。
我已經累到變行屍走肉,我已經累得沒有活力了。
這操作真的逆天,這做法真的令人意外。
整個被雷到外焦內嫩,我被嚇到了，感到非常驚訝。
講話可以不要這麼浮誇嗎,你可以不要講得那麼誇張嗎？
他發言太有事了,他的言論太不恰當了。
真的快原地升天,我真的快受不了了。
看到我眼球都快掉出來,這讓我目瞪口呆。
我黑人問號,我一臉困惑。
這件事我理解不能,我無法理解這件事。
整段邏輯翻車,整段話邏輯不通。
怎麼可以這麼地無語,這真的讓人無話可說。
這人講話太不帶腦,他說話太不經思考。
真的給你跪,我真的佩服你。
我情緒快炸成煙花,我情緒快要爆發了。
這操作我看傻眼,他的做法讓我感到驚訝。
看到直接精神出走,我看到後整個人出神了。
說出這句我人都尷尬癌牙起來,他這句話讓我覺得很尷尬。
